"2023/11/02 9:01:40 PM GMT+1","More than 36 years old","Non-binary ","Europe","More than 10 times","3-4 people","Sometimes","Usually","Yes","Yes","More in summer than winter, because I enjoy and find it tasty and healthy ","Rarely","Yes","No, I consult them elsewhere","Preference for Printed Recipes: You simply like physical books;Distractions: The notifications from your phone are distracting.","Always","Orange;Green;Yellow","Supportive","Creativ, because I enjoy mixing and inventing different combos of flavours. And because I love eating tasty food:) "
"2023/11/02 9:05:54 PM GMT+1","26-30 years old","Male","North America","4-6 times","2 people","Always","Sometimes","Yes","Yes","Can be interesting and tasty","Sometimes","Yes","Yes","Preference for Printed Recipes: You simply like physical books","Sometimes","Orange","Experienced","A little stressed if it is several things at a time or something new. As I get more experience that stress goes down"
"2023/11/02 9:13:42 PM GMT+1","31-35 years old","Female","North America","More than 10 times","2 people","Usually","Sometimes","Yes","Yes","Salads are good for you.","Sometimes","Yes","Yes","","Sometimes","This is an absurd question.","Experienced","Happy because I am making something with my own hands. "
"2023/11/02 9:16:55 PM GMT+1","More than 36 years old","Female","Europe","More than 10 times","More than 5 people","Usually","Sometimes","Yes","Yes","Keeps vitamines, saves time ","Never","Yes","Yes","Preference for Printed Recipes: You simply like physical books","Always","Green","Supportive","I feel good because I enjoy cutting vegetables ans thinking of the good meal the whole family will enjoy."
"2023/11/02 9:24:42 PM GMT+1","26-30 years old","Male","North America","1-3 times","1 (myself)","Usually","Sometimes","Yes","Yes","My enjoyment depends on the food item, just as it would with cooked food.","Rarely","Yes","Yes","","Usually","Orange","Social / Fun","In the zone. I branch out sometimes, but I am old hand at making my typical meals."
"2023/11/02 9:42:44 PM GMT+1","26-30 years old","Male","North America","1-3 times","2 people","Usually","Rarely","Yes","Yes","If they taste good","Always","Yes","Yes","","Rarely","Green;Red","Supportive","Busy, time strapped"
"2023/11/02 9:51:32 PM GMT+1","26-30 years old","Male","Asia","Never","1 (myself)","Always","Never","No","No","Disgusting ","Usually","Yes","No, I consult them elsewhere","Screen Size and Visibility: The screen is small and hard to see.","Always","Green","Experienced","Afraid"
"2023/11/02 10:05:52 PM GMT+1","21-25 years old","Male","North America","7-10 times","1 (myself)","Usually","Usually","Yes","Yes","Raw vegetables taste very good","Rarely","Yes","Yes","","Rarely","Green","Social / Fun","Usually very good. I find cooking to be very relaxing"
"2023/11/02 10:30:04 PM GMT+1","More than 36 years old","Male","North America","More than 10 times","2 people","Usually","Sometimes","Yes","Yes","Wife has early dementia and I am a two-time cancer survivor. Trying to eat a more plant-based diet.","Never","Yes","Yes","","Usually","Orange;Green;Yellow","Social / Fun","Great I know I making something healthy and affordable"
"2023/11/02 10:48:27 PM GMT+1","26-30 years old","Male","North America","7-10 times","1 (myself)","Usually","Sometimes","Yes","Yes","I am open to whatever is heathy, easy to make, and tasty.","Rarely","Yes","Yes","","Rarely","Green;Red","Supportive","Relaxed, it’s something of a meditative activity where I don’t have to think too hard and am doing something productive."
"2023/11/03 3:51:07 AM GMT+1","26-30 years old","Male","North America","4-6 times","1 (myself)","Usually","Usually","Yes","Yes","So easy","Usually","Yes","Yes","","Sometimes","Green","Experienced","Happy but challenged. Happy because I can focus on the task at hand and not worry about other things. Nervous because I am not an expert cook so things can go wrong and I need to focus"
"2023/11/03 4:38:27 AM GMT+1","More than 36 years old","Female","Europe","More than 10 times","3-4 people","Usually","Rarely","Yes","Yes","It's fresh and light","Rarely","Yes","No, I consult them elsewhere","Preference for Printed Recipes: You simply like physical books;Screen Size and Visibility: The screen is small and hard to see.","Usually","Orange","Social / Fun","Happy, because I love eating with my family."
"2023/11/03 5:38:15 AM GMT+1","More than 36 years old","Female","Europe","More than 10 times","More than 5 people","Always","Sometimes","Yes","No","There is no evidentiary support for the raw food diet; moreover, it renders nutrients less available and reduces the nutritional benefit of food. ","Rarely","Yes","I don't use recipes at all","I don't use recipes.","Always","I do not associate a cloud with eating.","The only people I cook with are my children.","Occupied. I have three children and two jobs."
"2023/11/03 3:01:35 PM GMT+1","26-30 years old","Female","North America","1-3 times","1 (myself)","Usually","Sometimes","Yes","Yes","Willing to try new things so long as they don’t put me at increased risk for getting sick, are not extremely expensive compared to usual options, and don’t require a large amount of effort to prepare compared to other options ","Sometimes","Yes","Yes","Preference for Printed Recipes: You simply like physical books;Screen Size and Visibility: The screen is small and hard to see.","Sometimes","Green","Supportive","Annoyed. I don’t want to mess up and I don’t generally enjoy cooking due to usually starting it when I’m hungry and then taking a long time to have food ready and I don’t enjoy the mess it makes."
"2023/11/05 10:18:20 PM GMT+1","21-25 years old","Female","Europe","1-3 times","2 people","Usually","Sometimes","Yes","Yes","Meilleurs nutriments","Sometimes","Yes","Yes","","Usually","Orange","Social / Fun","J'aime me consacrer à une tâche manuelle. Je me sens bien, sauf quand j'ai beaucoup de choses à faire à côté et ça m'embête de ""perdre"" du temps en cuisinant alors que je pourrais acheter (mais moins bonne qualité d'acheter)."
"2023/11/06 8:42:22 AM GMT+1","21-25 years old","Female","Europe","More than 10 times","1 (myself)","Usually","Usually","Yes","Yes","It's fast to have and I usually like the taste of non-meat raw food. ","Rarely","Yes","Yes","","Usually","Orange","Supportive","I really enjoy all the process. "
"2023/11/06 2:05:36 PM GMT+1","26-30 years old","Male","North America","Never","1 (myself)","Never","Never","Yes","Yes","First of all, I don't really consider raw food cooking. But I like them because they're generally healthier and have less calories.","Usually","No","Yes","","Never","Red","Experienced","Stressed. I hate it, it takes too long, instructions are always imprecise"